<data xmlns:xsi="http://www.w3.org/2001/XMLSchema-instance" xsi:noNamespaceSchemaLocation="../schemas/factions.xsd">
    <faction id="default" default="NEUTRAL"/>
    <faction id="player" default="NEUTRAL"/>
    <faction id="stratis_hotel_staff" default="NEUTRAL">
        <relation faction="enemy" type="HOSTILE"/>
    </faction>
    <faction id="enemy" default="HOSTILE">
        <relation faction="stratis_hotel_staff" type="HOSTILE"/>
    </faction>
    <faction id="nexus_staff" default="NEUTRAL"/>
    <faction id="cornerstore_staff" default="NEUTRAL"/>
</data>